Title,Published Date,Views,Likes,Comments
"Every Step You Take, Win $1,000",2026-02-18,47034255,807602,4534
Surprising My Fiancée With A Chocolate Heart,2026-02-12,57541076,1585600,13680
Guess What Age Punched You,2026-02-09,156854782,2782157,20532
"Ages 1 - 100 Race For $250,000!",2026-02-07,62123010,1355105,72254
"Flip a Coin, Win $30,000",2026-01-27,364258798,4631853,24993
Wait... Was He Famous?,2026-01-25,105958142,2683457,25625
"$1 vs $1,000,000,000 Futuristic Tech!",2026-01-24,104034893,2656701,83462
Survivor vs Beast Games,2026-01-16,27209694,730681,13272
Subscribe for an iPhone,2026-01-13,995285329,5686579,151791
Pass the Phone,2026-01-09,67777676,1630505,12269
